[
  {
    "source_id": "src_x_damngoodui",
    "source_type": "x",
    "name": "Damn Good UI",
    "url": "https://x.com/DamnGoodUI",
    "author_or_brand": "Damn Good UI",
    "platform_handle": "@DamnGoodUI",
    "credibility": "high",
    "notes": "Curated account posting polished UI interaction examples."
  }
]
